{
  "schema_version": "1.0.0",
  "authority": "ChangeBridge Part 1 Stage 4",
  "determinism_standard": {
    "seed": "Every generated run records the Hypothesis seed or reproducing example.",
    "clock": "Pure Stage 4 tests use fixed UTC timestamps; runtime clocks must be injected later.",
    "timezone": "UTC",
    "locale": "C.UTF-8",
    "ordering": "All unordered inputs are sorted before canonical serialization.",
    "versions": "Python and direct/transitive dependency versions are evidence-bound.",
    "paths": "Only normalized repository-relative paths enter evidence.",
    "volatile_fields": "Canonical identity rejects or explicitly excludes volatile fields.",
    "concurrency": "Schedules are enumerated and recorded instead of wall-clock raced.",
    "repeatability": "Generated views and validation reports are compared byte-for-byte across two clean runs.",
    "shrinking": "Hypothesis failures retain the minimal reproducing example and database-free seed metadata."
  },
  "layers": [
    {"id": "unit", "proof_target": "Pure canonicalization, parsing, and predicate branches.", "non_proof_boundary": "Does not prove adapter or service behavior.", "environment": "isolated local Python", "dependencies": ["pytest"], "fixture_scale": "single record", "deterministic_controls": ["fixed values", "no I/O"], "expected_duration": "under 5 seconds", "ci_placement": "every PR", "failure_artifact": "pytest assertion", "future_owner": "part2-runtime", "requirement_ids": ["CB-ORDER-001"], "invariant_ids": ["order", "evidence_binding"]},
    {"id": "generative_property", "proof_target": "Canonicalization and ordering properties over generated semantic inputs.", "non_proof_boundary": "Finite generated examples do not prove all values or managed transports.", "environment": "isolated local Python", "dependencies": ["pytest", "hypothesis==6.168.0"], "fixture_scale": "bounded generated records", "deterministic_controls": ["derandomized profile", "shrinking", "reproduction blob"], "expected_duration": "under 15 seconds", "ci_placement": "every PR", "failure_artifact": "minimal counterexample", "future_owner": "part2-runtime", "requirement_ids": ["CB-ORDER-001", "CB-ORDER-003"], "invariant_ids": ["order", "replay_determinism"]},
    {"id": "state_machine_model", "proof_target": "Lifecycle, checkpoint, proof, publication, and rollback transition legality.", "non_proof_boundary": "Does not prove distributed storage atomicity.", "environment": "local model", "dependencies": ["pytest"], "fixture_scale": "bounded transition schedules", "deterministic_controls": ["enumerated schedule", "fixed initial state"], "expected_duration": "under 20 seconds", "ci_placement": "every PR", "failure_artifact": "minimal transition trace", "future_owner": "part2-runtime", "requirement_ids": ["CB-CHECKPOINT-001", "CB-PUBLISH-001"], "invariant_ids": ["checkpoint_coupling", "proof_before_publication", "rollback_safety"]},
    {"id": "contract", "proof_target": "JSON Schema structure plus semantic cross-field rules.", "non_proof_boundary": "Does not prove producers emit conforming records.", "environment": "isolated local Python", "dependencies": ["jsonschema==4.26.0"], "fixture_scale": "all authority schemas and fixtures", "deterministic_controls": ["Draft 2020-12", "stable first-error selection"], "expected_duration": "under 10 seconds", "ci_placement": "every PR", "failure_artifact": "stable diagnostic code", "future_owner": "part2-runtime", "requirement_ids": ["CB-ORDER-001", "CB-SCHEMA-001"], "invariant_ids": ["schema_safety", "evidence_binding"]},
    {"id": "differential", "proof_target": "Future adapters produce the same canonical state and proof digests as the local oracle.", "non_proof_boundary": "Stage 4 defines but does not execute adapters.", "environment": "future disposable adapter environment", "dependencies": [], "fixture_scale": "shared workload corpus", "deterministic_controls": ["same input digest", "same frontier", "same canonicalization version"], "expected_duration": "future bounded", "ci_placement": "Part 2 CI", "failure_artifact": "state/proof digest diff", "future_owner": "part2-runtime", "requirement_ids": ["CB-ORDER-003"], "invariant_ids": ["replay_determinism"]},
    {"id": "integration", "proof_target": "Runtime components exchange versioned records across real local boundaries.", "non_proof_boundary": "Local integration does not prove AWS services.", "environment": "future local integration stack", "dependencies": [], "fixture_scale": "small multi-transaction workload", "deterministic_controls": ["fixed workload", "fixed faults", "isolated namespace"], "expected_duration": "future under 5 minutes", "ci_placement": "Part 2 CI", "failure_artifact": "component logs and record bundle", "future_owner": "part2-runtime", "requirement_ids": ["CB-CHECKPOINT-001"], "invariant_ids": ["checkpoint_coupling", "failure_atomicity"]},
    {"id": "failure", "proof_target": "Crash, retry, duplicate, conflict, stale writer, and rollback outcomes.", "non_proof_boundary": "Local injection does not establish managed failure rates.", "environment": "local deterministic simulator now; runtime harness later", "dependencies": ["pytest"], "fixture_scale": "13 preserved plus adversarial corpus", "deterministic_controls": ["named fault point", "fixed pre/post state", "recorded schedule"], "expected_duration": "under 30 seconds locally", "ci_placement": "every PR", "failure_artifact": "scenario verdict and state diff", "future_owner": "part2-runtime", "requirement_ids": ["CB-APPLY-004", "CB-PUBLISH-003"], "invariant_ids": ["failure_atomicity", "stale_writer_rejection"]},
    {"id": "infrastructure_security", "proof_target": "Future least privilege, encryption, isolation, lifecycle, and teardown controls.", "non_proof_boundary": "Static Terraform checks do not prove deployed controls.", "environment": "future ephemeral AWS account/namespace", "dependencies": [], "fixture_scale": "one isolated deployment", "deterministic_controls": ["exact Terraform commit", "captured plan/apply IDs"], "expected_duration": "future bounded", "ci_placement": "Part 3 gated workflow", "failure_artifact": "resource inventory and policy evaluation", "future_owner": "part3-managed-proof", "requirement_ids": ["CB-SEC-001"], "invariant_ids": ["generation_isolation", "evidence_binding"]},
    {"id": "performance_metric", "proof_target": "Future bounded throughput, latency, recovery, and cost measurements.", "non_proof_boundary": "No Stage 4 local result is a performance claim.", "environment": "future managed experiment", "dependencies": [], "fixture_scale": "declared workload and duration", "deterministic_controls": ["workload identity", "warmup window", "raw observations", "resource inventory"], "expected_duration": "future declared per experiment", "ci_placement": "Part 3 manual gate", "failure_artifact": "raw samples and statistical summary", "future_owner": "part3-managed-proof", "requirement_ids": ["CB-OPS-004"], "invariant_ids": ["evidence_binding"]},
    {"id": "evidence_integrity", "proof_target": "Commit, run, artifact, resource, label, limitation, and producer-version binding.", "non_proof_boundary": "Integrity does not prove the underlying system is correct.", "environment": "local and future managed", "dependencies": ["jsonschema==4.26.0"], "fixture_scale": "complete evidence bundle", "deterministic_controls": ["SHA-256", "repository-relative paths", "exact commit/run IDs"], "expected_duration": "under 10 seconds locally", "ci_placement": "every PR and post-merge", "failure_artifact": "exact missing or mismatched reference", "future_owner": "part3-managed-proof", "requirement_ids": ["CB-EVIDENCE-001", "CB-EVIDENCE-002"], "invariant_ids": ["evidence_binding"]}
  ]
}
